{
  "$schema": "http://json-schema.org/draft-07/schema#",
  "title": "Cursor Environment Configuration Schema",
  "description": "Schema for Cursor IDE environment configuration for React/Vite/Bun projects",
  "type": "object",
  "required": ["user", "install"],
  "properties": {
    "user": {
      "type": "string",
      "description": "The user account to run commands under",
      "default": "ubuntu"
    },
    "dockerfile": {
      "type": "string",
      "description": "Path to the Dockerfile for the environment",
      "default": ".cursor/Dockerfile"
    },
    "install": {
      "type": "string",
      "description": "Command to install project dependencies",
      "pattern": "^bun (install|i)$"
    },
    "start": {
      "type": "string",
      "description": "Optional command to start the main application",
      "default": ""
    },
    "terminals": {
      "type": "array",
      "description": "Predefined terminal configurations",
      "items": {
        "type": "object",
        "required": ["name", "command", "description"],
        "properties": {
          "name": {
            "type": "string",
            "description": "Terminal tab name"
          },
          "command": {
            "type": "string",
            "description": "Command to run in this terminal"
          },
          "description": {
            "type": "string",
            "description": "Human-readable description of what this terminal does"
          },
          "auto_start": {
            "type": "boolean",
            "description": "Whether to automatically start this terminal",
            "default": false
          }
        }
      }
    },
    "environment_variables": {
      "type": "object",
      "description": "Environment variables to set",
      "additionalProperties": {
        "type": "string"
      }
    },
    "ports": {
      "type": "array",
      "description": "Ports to expose",
      "items": {
        "type": "object",
        "required": ["port", "description"],
        "properties": {
          "port": {
            "type": "integer",
            "minimum": 1,
            "maximum": 65535
          },
          "description": {
            "type": "string"
          },
          "auto_forward": {
            "type": "boolean",
            "default": true
          }
        }
      }
    }
  }
}
